{
  "language": "csharp",
  "category": "oop_enterprise",
  "level": 5,
  "unit": 3,
  "unit_title": "상속과 virtual/override",
  "questions": [
    {
      "id": "csharp_l5_u03_q001",
      "type": "predict_output",
      "code": "class Animal\n{\n    public virtual void Speak()\n    {\n        Console.WriteLine(\"동물이 소리를 낸다\");\n    }\n}\n\nclass Dog : Animal\n{\n    public override void Speak()\n    {\n        Console.WriteLine(\"멍멍!\");\n    }\n}\n\nAnimal a = new Dog();\na.Speak();",
      "prompt_en": "What is printed?",
      "prompt_ko": "출력 결과는?",
      "options": ["동물이 소리를 낸다", "멍멍!", "오류", "둘 다 출력됨"],
      "answer": 1,
      "explanation_en": "Even though a is declared as Animal, virtual/override makes the call resolve based on the actual object type (Dog) at runtime, printing 멍멍!.",
      "explanation_ko": "a가 Animal 타입으로 선언되어 있어도, virtual/override 덕분에 실제 객체 타입(Dog)을 기준으로 실행 시점에 호출이 결정되어 멍멍!이 출력됩니다.",
      "concept_tags": ["inheritance", "virtual", "override"],
      "difficulty": "practice"
    },
    {
      "id": "csharp_l5_u03_q002",
      "type": "error_finding",
      "code": "class Animal\n{\n    public void Speak()\n    {\n        Console.WriteLine(\"동물이 소리를 낸다\");\n    }\n}\n\nclass Dog : Animal\n{\n    public override void Speak()\n    {\n        Console.WriteLine(\"멍멍!\");\n    }\n}",
      "prompt_en": "What problem does this code have?",
      "prompt_ko": "이 코드는 어떤 문제가 있을까요?",
      "options": [
        "상속 문법 오류",
        "부모의 Speak가 virtual로 선언되지 않았는데 자식에서 override를 시도해서, 컴파일 오류(CS0506)가 발생함",
        "Dog 클래스 이름이 잘못됨",
        "문제 없음, 정상적으로 오버라이드됨"
      ],
      "answer": 1,
      "explanation_en": "Like VB's Overridable/Overrides pair, C# requires the base method to be explicitly virtual before it can be overridden; attempting override on a non-virtual method is a compile error, unlike C++ where forgetting virtual only causes a silent behavior difference.",
      "explanation_ko": "VB의 Overridable/Overrides 쌍과 마찬가지로, C#은 부모 메서드가 명시적으로 virtual이어야만 오버라이드할 수 있습니다. virtual이 아닌 메서드에 override를 시도하면 컴파일 오류가 발생합니다. virtual을 빠뜨려도 조용히 동작 차이만 생기는 C++와 다른 점입니다.",
      "concept_tags": ["virtual", "override"],
      "difficulty": "challenge"
    },
    {
      "id": "csharp_l5_u03_q003",
      "type": "predict_output",
      "code": "class Animal\n{\n    public void Speak()\n    {\n        Console.WriteLine(\"동물이 소리를 낸다\");\n    }\n}\n\nclass Dog : Animal\n{\n    public new void Speak()\n    {\n        Console.WriteLine(\"멍멍!\");\n    }\n}\n\nAnimal a = new Dog();\na.Speak();",
      "prompt_en": "What is printed? (Note: new is used instead of virtual/override.)",
      "prompt_ko": "출력 결과는? (virtual/override 대신 new가 쓰인 점에 주의하세요.)",
      "options": ["멍멍!", "동물이 소리를 낸다", "오류", "둘 다 출력됨"],
      "answer": 1,
      "explanation_en": "new explicitly hides the base method rather than overriding it (VB's Shadows equivalent); calling through an Animal-typed reference resolves to Animal's own version at compile time.",
      "explanation_ko": "new는 부모 메서드를 오버라이드하는 게 아니라 명시적으로 숨깁니다(VB의 Shadows에 해당). Animal 타입 참조를 통한 호출은 컴파일 시점에 Animal 자신의 버전으로 결정됩니다.",
      "concept_tags": ["shadowing", "virtual"],
      "difficulty": "challenge"
    },
    {
      "id": "csharp_l5_u03_q004",
      "type": "fill_blank",
      "code": "class Cat ____ Animal\n{\n    public override void Speak()\n    {\n        Console.WriteLine(\"야옹!\");\n    }\n}",
      "prompt_en": "Fill in the blank with the symbol that makes Cat inherit from Animal.",
      "prompt_ko": "Cat이 Animal을 상속받도록 빈칸에 들어갈 기호는?",
      "options": [":", "extends", "Inherits", "->"],
      "answer": 0,
      "explanation_en": "C# uses a colon after the class name to establish inheritance, the same syntax as C++.",
      "explanation_ko": "C#은 클래스 이름 뒤에 콜론을 붙여 상속 관계를 설정합니다. C++와 같은 문법입니다.",
      "concept_tags": ["inheritance"],
      "difficulty": "intro"
    },
    {
      "id": "csharp_l5_u03_q005",
      "type": "predict_output",
      "code": "class Animal\n{\n    protected string Name;\n    public Animal(string name)\n    {\n        Name = name;\n    }\n}\n\nclass Dog : Animal\n{\n    public Dog(string name) : base(name) { }\n    public void PrintName()\n    {\n        Console.WriteLine(Name);\n    }\n}\n\nDog d = new Dog(\"바둑이\");\nd.PrintName();",
      "prompt_en": "What is printed?",
      "prompt_ko": "출력 결과는?",
      "options": ["바둑이", "오류", "빈 문자열", "Animal"],
      "answer": 0,
      "explanation_en": ": base(name) calls the parent's constructor, initializing the inherited Name field; PrintName then reads that field, printing 바둑이.",
      "explanation_ko": ": base(name)는 부모의 생성자를 호출해서 상속받은 Name 필드를 초기화합니다. PrintName은 이후 그 필드를 읽어 바둑이를 출력합니다.",
      "concept_tags": ["inheritance", "base_keyword"],
      "difficulty": "practice"
    },
    {
      "id": "csharp_l5_u03_q006",
      "type": "concept_matching",
      "code": null,
      "prompt_en": "Match each term to its description.",
      "prompt_ko": "용어와 설명을 올바르게 연결하세요.",
      "pairs": [
        { "term": ": (상속)", "definition": "한 클래스가 다른 클래스를 상속받게 하는 기호" },
        { "term": "virtual", "definition": "부모 메서드를 자식이 재정의할 수 있도록 허용하는 키워드" },
        { "term": "override", "definition": "자식 클래스에서 부모의 virtual 메서드를 실제로 재정의하는 키워드" },
        { "term": "base(...)", "definition": "자식 생성자에서 부모의 생성자를 명시적으로 호출하는 문법" }
      ],
      "explanation_en": "C#'s virtual/override pair maps directly to VB's Overridable/Overrides, and base(...) maps to MyBase.New(...) — the concepts are identical, only the keywords differ.",
      "explanation_ko": "C#의 virtual/override는 VB의 Overridable/Overrides에, base(...)는 MyBase.New(...)에 직접 대응합니다 — 개념은 동일하고 키워드만 다릅니다.",
      "concept_tags": ["inheritance", "virtual", "override", "base_keyword"],
      "difficulty": "practice"
    }
  ]
}
