{
  "language": "basic_early",
  "category": "legacy_historical",
  "level": 1,
  "unit": 1,
  "unit_title": "변수와 PRINT문",
  "questions": [
    {
      "id": "basic_early_l1_u01_q001",
      "type": "predict_output",
      "code": "10 LET X = 7\n20 LET Y = 2\n30 PRINT X / Y",
      "prompt_en": "What is printed?",
      "prompt_ko": "출력 결과는?",
      "options": ["3", "3.5", "4", "오류"],
      "answer": 1,
      "explanation_en": "Classic BASIC treats numbers as floating-point by default, so division returns a decimal result.",
      "explanation_ko": "초기 BASIC은 별도의 자료형 선언 없이 숫자를 기본적으로 실수로 다루기 때문에 나눗셈 결과도 소수점 형태로 나옵니다.",
      "concept_tags": ["division_operator", "variable"],
      "difficulty": "intro"
    },
    {
      "id": "basic_early_l1_u01_q002",
      "type": "predict_output",
      "code": "10 LET N = 5\n20 PRINT N",
      "prompt_en": "What is printed?",
      "prompt_ko": "출력 결과는?",
      "options": ["N", "5", "오류", "빈 화면"],
      "answer": 1,
      "explanation_en": "PRINT outputs the current value stored in the variable, not its name.",
      "explanation_ko": "PRINT문은 변수의 이름이 아니라 그 변수에 저장된 값을 출력합니다.",
      "concept_tags": ["print_statement", "variable"],
      "difficulty": "intro"
    },
    {
      "id": "basic_early_l1_u01_q003",
      "type": "fill_blank",
      "code": "10 ____ A = 10\n20 PRINT A",
      "prompt_en": "Fill in the keyword used to assign a value to a variable.",
      "prompt_ko": "변수에 값을 대입할 때 사용하는 키워드는?",
      "options": ["LET", "SET", "DIM", "VAR"],
      "answer": 0,
      "explanation_en": "Classic BASIC uses the LET keyword to assign values, though many dialects allow omitting it.",
      "explanation_ko": "초기 BASIC은 값을 대입할 때 LET 키워드를 사용합니다. 다만 일부 방언에서는 LET을 생략할 수도 있습니다.",
      "concept_tags": ["assignment", "let_keyword"],
      "difficulty": "intro"
    },
    {
      "id": "basic_early_l1_u01_q004",
      "type": "error_finding",
      "code": "10 LET B = 20\n20 PRNT B",
      "prompt_en": "Which line contains the error?",
      "prompt_ko": "오류가 있는 줄은 어디인가요?",
      "options": ["1번째 줄 (LET 사용법)", "2번째 줄 (PRINT 오타)", "오류 없음", "줄 번호 문제"],
      "answer": 1,
      "explanation_en": "PRNT is a typo; the correct keyword is PRINT.",
      "explanation_ko": "PRNT는 오타이며, 올바른 키워드는 PRINT입니다.",
      "concept_tags": ["syntax", "print_statement"],
      "difficulty": "intro"
    },
    {
      "id": "basic_early_l1_u01_q005",
      "type": "concept_matching",
      "code": null,
      "prompt_en": "Match each keyword to its role.",
      "prompt_ko": "키워드와 역할을 올바르게 연결하세요.",
      "pairs": [
        { "term": "LET", "definition": "변수에 값을 대입" },
        { "term": "PRINT", "definition": "값을 화면에 출력" },
        { "term": "INPUT", "definition": "사용자로부터 값을 입력받음" },
        { "term": "줄 번호 (10, 20...)", "definition": "실행 순서를 정하는 구조" }
      ],
      "explanation_en": "Classic BASIC programs are organized by numbered lines, which determine execution order without needing functions or blocks.",
      "explanation_ko": "초기 BASIC 프로그램은 줄 번호로 구성되며, 함수나 블록 없이도 이 번호가 실행 순서를 결정합니다. 이는 이후 등장한 구조적 프로그래밍 언어와 대비되는 역사적 특징입니다.",
      "concept_tags": ["line_number", "print_statement", "input_statement"],
      "difficulty": "practice"
    }
  ]
}
