{
  "language": "php",
  "category": "scripting",
  "level": 2,
  "unit": 1,
  "unit_title": "if/elseif/else",
  "questions": [
    {
      "id": "php_l2_u01_q001",
      "type": "predict_output",
      "code": "$score = 85;\nif ($score >= 90) {\n    echo \"A\";\n} elseif ($score >= 80) {\n    echo \"B\";\n} else {\n    echo \"C\";\n}",
      "prompt_en": "What is printed?",
      "prompt_ko": "출력 결과는?",
      "options": ["A", "B", "C", "아무것도 출력되지 않음"],
      "answer": 1,
      "explanation_en": "score is 85, which fails the first condition (>= 90) but satisfies elseif's (>= 80), so B is printed.",
      "explanation_ko": "score는 85이므로 첫 번째 조건(90 이상)은 거짓이지만 elseif의 조건(80 이상)은 참입니다. 따라서 B가 출력됩니다.",
      "concept_tags": ["if_statement", "elseif"],
      "difficulty": "intro"
    },
    {
      "id": "php_l2_u01_q002",
      "type": "fill_blank",
      "code": "$age = 20;\nif ($age >= 18) {\n    echo \"성인\";\n} ____ ($age >= 13) {\n    echo \"청소년\";\n} else {\n    echo \"어린이\";\n}",
      "prompt_en": "Fill in the blank with PHP's single-word keyword for 'else if'.",
      "prompt_ko": "'else if'에 해당하는 PHP의 한 단어 키워드를 빈칸에 채우세요.",
      "options": ["elseif", "else if", "elif", "elsif"],
      "answer": 0,
      "explanation_en": "PHP uses elseif as one word (though 'else if' with a space also works), similar to Python's elif but spelled differently.",
      "explanation_ko": "PHP는 elseif를 한 단어로 씁니다('else if'라고 띄어써도 동작합니다). Python의 elif와 비슷한 개념이지만 철자가 다릅니다.",
      "concept_tags": ["elseif"],
      "difficulty": "intro"
    },
    {
      "id": "php_l2_u01_q003",
      "type": "predict_output",
      "code": "$x = 5;\nif ($x == 5) echo \"다섯\";",
      "prompt_en": "What is printed? (Note: no curly braces.)",
      "prompt_ko": "출력 결과는? (중괄호가 없는 점에 주의하세요.)",
      "options": ["다섯", "오류: 중괄호가 없음", "아무것도 출력되지 않음", "x"],
      "answer": 0,
      "explanation_en": "PHP allows omitting curly braces when the if body is a single statement, the same as C, Java, and JavaScript.",
      "explanation_ko": "PHP는 if 본문이 한 문장일 때 중괄호를 생략할 수 있습니다. C, Java, JavaScript와 동일합니다.",
      "concept_tags": ["if_statement"],
      "difficulty": "practice"
    },
    {
      "id": "php_l2_u01_q004",
      "type": "predict_output",
      "code": "$temp = 15;\nif ($temp > 30):\n    echo \"더움\";\nelseif ($temp > 10):\n    echo \"선선함\";\nelse:\n    echo \"추움\";\nendif;",
      "prompt_en": "What is printed? (This is PHP's alternative syntax using colons, common in templates.)",
      "prompt_ko": "출력 결과는? (템플릿에서 흔한, 콜론을 쓰는 PHP의 대체 문법입니다.)",
      "options": ["더움", "선선함", "추움", "오류"],
      "answer": 1,
      "explanation_en": "PHP offers an alternative colon-based syntax (if: ... elseif: ... else: ... endif;) often used when mixing PHP with HTML; temp is 15, satisfying the elseif condition, printing 선선함.",
      "explanation_ko": "PHP는 콜론 기반의 대체 문법(if: ... elseif: ... else: ... endif;)을 제공하며, PHP와 HTML을 섞을 때 흔히 씁니다. temp가 15이므로 elseif 조건을 만족해 선선함이 출력됩니다.",
      "concept_tags": ["alternative_syntax"],
      "difficulty": "challenge"
    },
    {
      "id": "php_l2_u01_q005",
      "type": "predict_output",
      "code": "$age = 20;\nif ($age >= 18) {\n    echo \"성인\";\n}",
      "prompt_en": "What is printed?",
      "prompt_ko": "출력 결과는?",
      "options": ["성인", "오류", "아무것도 출력되지 않음", "18"],
      "answer": 0,
      "explanation_en": "The condition is true, so the if block runs, printing 성인.",
      "explanation_ko": "조건이 참이므로 if 블록이 실행되어 성인이 출력됩니다.",
      "concept_tags": ["if_statement"],
      "difficulty": "intro"
    },
    {
      "id": "php_l2_u01_q006",
      "type": "concept_matching",
      "code": null,
      "prompt_en": "Match each term to its description.",
      "prompt_ko": "용어와 설명을 올바르게 연결하세요.",
      "pairs": [
        { "term": "if / elseif / else", "definition": "조건에 따라 분기하는 기본 구조" },
        { "term": "elseif (한 단어)", "definition": "PHP에서 'else if'에 해당하는 한 단어 키워드" },
        { "term": "중괄호 생략", "definition": "본문이 한 문장이면 {}를 생략할 수 있는 문법" },
        { "term": "대체 문법 (if: ... endif;)", "definition": "HTML과 PHP를 섞어 쓸 때 흔히 쓰이는 콜론 기반 문법" }
      ],
      "explanation_en": "PHP's alternative colon syntax exists specifically because PHP was originally designed as a templating language embedded in HTML, a historical quirk not found in most other languages in this curriculum.",
      "explanation_ko": "PHP의 콜론 기반 대체 문법은 PHP가 원래 HTML에 삽입되는 템플릿 언어로 설계됐기 때문에 존재합니다. 이 커리큘럼의 다른 대부분 언어에는 없는 역사적 특징입니다.",
      "concept_tags": ["if_statement", "elseif", "alternative_syntax"],
      "difficulty": "practice"
    }
  ]
}
