{
  "language": "cpp",
  "category": "system_low_level",
  "level": 3,
  "unit": 3,
  "unit_title": "다형성 활용",
  "questions": [
    {
      "id": "cpp_l3_u03_q001",
      "type": "predict_output",
      "code": "class Animal {\npublic:\n    virtual void speak() { cout << \"...\"; }\n};\nclass Dog : public Animal {\npublic:\n    void speak() override { cout << \"멍멍!\"; }\n};\nclass Cat : public Animal {\npublic:\n    void speak() override { cout << \"야옹!\"; }\n};\n\nAnimal *animals[2];\nanimals[0] = new Dog();\nanimals[1] = new Cat();\nfor (int i = 0; i < 2; i++) {\n    animals[i]->speak();\n}",
      "prompt_en": "What is printed?",
      "prompt_ko": "출력 결과는?",
      "options": ["...", "...멍멍!야옹!", "멍멍!야옹!", "야옹!멍멍!"],
      "answer": 2,
      "explanation_en": "An array of Animal pointers can hold different subclass objects; virtual dispatch calls each object's own speak(), printing 멍멍! then 야옹!.",
      "explanation_ko": "Animal 포인터 배열은 서로 다른 자식 클래스 객체를 담을 수 있습니다. virtual 디스패치가 각 객체 자신의 speak()를 호출해 멍멍!, 야옹! 순서로 출력됩니다.",
      "concept_tags": ["polymorphism"],
      "difficulty": "practice"
    },
    {
      "id": "cpp_l3_u03_q002",
      "type": "concept_matching",
      "code": null,
      "prompt_en": "Match each term to its description.",
      "prompt_ko": "용어와 설명을 올바르게 연결하세요.",
      "pairs": [
        { "term": "다형성", "definition": "같은 인터페이스(함수 호출)로 서로 다른 클래스의 객체가 각자 다르게 동작하는 성질" },
        { "term": "부모 타입 배열/포인터", "definition": "여러 자식 클래스의 객체를 하나의 배열이나 포인터 타입으로 통일해서 다루는 방법" },
        { "term": "런타임 다형성", "definition": "virtual 함수를 통해 실행 시점에 실제 객체 타입에 따라 동작이 결정되는 다형성" },
        { "term": "코드 확장성", "definition": "새 동물 클래스를 추가해도 기존의 순회·호출 코드를 바꿀 필요가 없는 다형성의 장점" }
      ],
      "explanation_en": "Polymorphism is what makes it possible to write a single loop that works correctly regardless of how many different Animal subclasses exist.",
      "explanation_ko": "다형성 덕분에 Animal의 자식 클래스가 몇 개든 상관없이, 하나의 반복문 코드로 모두 올바르게 동작하게 만들 수 있습니다.",
      "concept_tags": ["polymorphism"],
      "difficulty": "practice"
    },
    {
      "id": "cpp_l3_u03_q003",
      "type": "predict_output",
      "code": "class Shape {\npublic:\n    virtual double area() {\n        return 0;\n    }\n};\nclass Circle : public Shape {\npublic:\n    double radius;\n    Circle(double r) : radius(r) {}\n    double area() override {\n        return 3.14 * radius * radius;\n    }\n};\nclass Square : public Shape {\npublic:\n    double side;\n    Square(double s) : side(s) {}\n    double area() override {\n        return side * side;\n    }\n};\n\ndouble totalArea(Shape* shapes[], int count) {\n    double total = 0;\n    for (int i = 0; i < count; i++) {\n        total += shapes[i]->area();\n    }\n    return total;\n}\n\nShape* shapes[2] = { new Circle(1), new Square(2) };\ncout << totalArea(shapes, 2);",
      "prompt_en": "What is printed? (Circle area with radius 1: 3.14, Square area with side 2: 4)",
      "prompt_ko": "출력 결과는? (반지름 1인 원의 넓이: 3.14, 변 2인 정사각형의 넓이: 4)",
      "options": ["3.14", "4", "7.14", "0"],
      "answer": 2,
      "explanation_en": "totalArea works with any Shape subclass through polymorphism; it sums Circle's 3.14 and Square's 4, giving 7.14.",
      "explanation_ko": "totalArea는 다형성 덕분에 어떤 Shape 자식 클래스와도 동작합니다. Circle의 3.14와 Square의 4를 더해 7.14가 됩니다.",
      "concept_tags": ["polymorphism"],
      "difficulty": "challenge"
    },
    {
      "id": "cpp_l3_u03_q004",
      "type": "fill_blank",
      "code": "void makeAllSpeak(____ *animals[], int count) {\n    for (int i = 0; i < count; i++) {\n        animals[i]->speak();\n    }\n}\n// Dog든 Cat이든 어떤 Animal의 자식이든 모두 처리할 수 있어야 함",
      "prompt_en": "Fill in the blank with the type that lets this function accept any Animal subclass.",
      "prompt_ko": "이 함수가 어떤 Animal 자식 클래스든 받을 수 있도록 빈칸에 들어갈 타입은?",
      "options": ["Animal", "Dog", "Cat", "void"],
      "answer": 0,
      "explanation_en": "Using the base class Animal as the pointer type lets the function accept Dog, Cat, or any other Animal subclass through polymorphism.",
      "explanation_ko": "부모 클래스인 Animal을 포인터 타입으로 쓰면, 다형성 덕분에 Dog, Cat 등 어떤 Animal 자식 클래스도 이 함수에 전달할 수 있습니다.",
      "concept_tags": ["polymorphism"],
      "difficulty": "practice"
    },
    {
      "id": "cpp_l3_u03_q005",
      "type": "error_finding",
      "code": "class Animal {\npublic:\n    void speak() {\n        cout << \"...\";\n    }\n};\nclass Dog : public Animal {\npublic:\n    void speak() {\n        cout << \"멍멍!\";\n    }\n};\n\nAnimal *animals[1] = { new Dog() };\nanimals[0]->speak();",
      "prompt_en": "If the programmer expected 멍멍! to print, what actually goes wrong?",
      "prompt_ko": "프로그래머가 멍멍!이 출력될 것이라 기대했다면, 실제로는 무엇이 잘못됐을까요?",
      "options": [
        "배열 초기화 문법 오류",
        "speak()에 virtual이 없어서, 실제로는 ...이 출력됨 (Dog의 재정의가 적용되지 않음)",
        "new Dog() 문법 오류",
        "문제 없음, 멍멍!이 정상 출력됨"
      ],
      "answer": 1,
      "explanation_en": "Without virtual, calling speak() through an Animal* uses static binding based on the pointer's declared type, so Animal's version (\"...\") runs instead of Dog's override.",
      "explanation_ko": "virtual이 없으면 Animal* 를 통한 speak() 호출은 포인터의 선언 타입을 기준으로 정적 바인딩됩니다. 그래서 Dog의 재정의가 아니라 Animal의 버전(\"...\")이 실행됩니다.",
      "concept_tags": ["polymorphism", "virtual"],
      "difficulty": "challenge"
    },
    {
      "id": "cpp_l3_u03_q006",
      "type": "concept_matching",
      "code": null,
      "prompt_en": "Match each term to its description.",
      "prompt_ko": "용어와 설명을 올바르게 연결하세요.",
      "pairs": [
        { "term": "다형성의 전제조건", "definition": "부모 클래스의 함수가 virtual로 선언되어 있어야 함" },
        { "term": "Shape* shapes[]", "definition": "서로 다른 도형 클래스를 하나의 배열로 다루기 위한 부모 타입 배열" },
        { "term": "총합 계산 함수", "definition": "각 도형이 무엇인지 몰라도 동작하는, 다형성을 활용한 범용 함수" },
        { "term": "virtual 누락의 결과", "definition": "재정의가 무시되고 부모 클래스의 함수가 대신 호출되는 현상" }
      ],
      "explanation_en": "Polymorphism only works as expected when virtual is present; forgetting it is one of the most common and subtle bugs in C++ inheritance code.",
      "explanation_ko": "다형성은 virtual이 있을 때만 기대한 대로 동작합니다. 이를 빠뜨리는 것은 C++ 상속 코드에서 가장 흔하면서도 미묘한 버그 중 하나입니다.",
      "concept_tags": ["polymorphism", "virtual"],
      "difficulty": "practice"
    }
  ]
}
