{
  "language": "php",
  "category": "scripting",
  "level": 1,
  "unit": 1,
  "unit_title": "변수와 자료형",
  "questions": [
    {
      "id": "php_l1_u01_q001",
      "type": "predict_output",
      "code": "$age = 25;\necho $age;",
      "prompt_en": "What is printed?",
      "prompt_ko": "출력 결과는?",
      "options": ["age", "$age", "25", "오류"],
      "answer": 2,
      "explanation_en": "Every PHP variable must start with $; $age holds 25, which echo prints.",
      "explanation_ko": "모든 PHP 변수는 반드시 $로 시작합니다. $age는 25를 담고 있으며, echo가 이를 출력합니다.",
      "concept_tags": ["variable", "dollar_sigil"],
      "difficulty": "intro"
    },
    {
      "id": "php_l1_u01_q002",
      "type": "error_finding",
      "code": "age = 25;\necho $age;",
      "prompt_en": "What problem does this code have?",
      "prompt_ko": "이 코드는 어떤 문제가 있을까요?",
      "options": [
        "25 리터럴 문법 오류",
        "PHP 변수는 반드시 $로 시작해야 하는데 이를 빠뜨려서, age를 상수로 취급하려다 오류가 발생함",
        "echo 사용법 오류",
        "문제 없음, 정상 동작함"
      ],
      "answer": 1,
      "explanation_en": "Unlike most languages covered so far, PHP requires every variable name to be prefixed with $; without it, age = 25 isn't valid variable assignment syntax at all.",
      "explanation_ko": "지금까지 다룬 대부분의 언어와 달리, PHP는 모든 변수 이름 앞에 $를 붙여야 합니다. 이것이 없으면 age = 25는 애초에 유효한 변수 대입 문법이 아닙니다.",
      "concept_tags": ["dollar_sigil"],
      "difficulty": "challenge"
    },
    {
      "id": "php_l1_u01_q003",
      "type": "predict_output",
      "code": "$arr = [1, 2, 3];\n$assoc = [\"a\" => 1, \"b\" => 2];\necho gettype($arr) . \" \" . gettype($assoc);",
      "prompt_en": "What is printed? (Note: one is indexed, one has string keys — but check their type.)",
      "prompt_ko": "출력 결과는? (하나는 인덱스 배열, 하나는 문자열 키를 가진 배열이지만, 타입을 확인해보세요.)",
      "options": ["array array", "array object", "list dictionary", "오류"],
      "answer": 0,
      "explanation_en": "PHP has only one array type that serves as both an indexed list and an associative map (like a dictionary); both $arr and $assoc are simply \"array\".",
      "explanation_ko": "PHP는 인덱스 리스트와 연관 배열(딕셔너리 같은) 역할을 모두 하는 배열 타입이 하나뿐입니다. $arr와 $assoc 둘 다 그냥 \"array\"입니다.",
      "concept_tags": ["array", "gettype"],
      "difficulty": "challenge"
    },
    {
      "id": "php_l1_u01_q004",
      "type": "predict_output",
      "code": "$assoc = [\"a\" => 1, \"b\" => 2];\necho $assoc[\"a\"];",
      "prompt_en": "What is printed?",
      "prompt_ko": "출력 결과는?",
      "options": ["1", "a", "오류", "0"],
      "answer": 0,
      "explanation_en": "Associative arrays use string (or any) keys instead of numeric indices; $assoc[\"a\"] retrieves the value 1.",
      "explanation_ko": "연관 배열은 숫자 인덱스 대신 문자열(또는 어떤) 키를 사용합니다. $assoc[\"a\"]는 값 1을 가져옵니다.",
      "concept_tags": ["array"],
      "difficulty": "intro"
    },
    {
      "id": "php_l1_u01_q005",
      "type": "fill_blank",
      "code": "____name = \"Kim\";\necho $name;",
      "prompt_en": "Fill in the blank with the sigil every PHP variable requires.",
      "prompt_ko": "모든 PHP 변수가 필요로 하는 기호를 빈칸에 채우세요.",
      "options": ["$", "@", "&", "#"],
      "answer": 0,
      "explanation_en": "$ marks the start of every variable name in PHP; it's not optional, unlike sigils in some other languages.",
      "explanation_ko": "$는 PHP에서 모든 변수 이름의 시작을 표시합니다. 다른 일부 언어의 기호와 달리 선택 사항이 아닙니다.",
      "concept_tags": ["dollar_sigil"],
      "difficulty": "intro"
    },
    {
      "id": "php_l1_u01_q006",
      "type": "concept_matching",
      "code": null,
      "prompt_en": "Match each term to its description.",
      "prompt_ko": "용어와 설명을 올바르게 연결하세요.",
      "pairs": [
        { "term": "$ 기호", "definition": "모든 PHP 변수 이름에 필수로 붙는 접두사" },
        { "term": "array", "definition": "인덱스 리스트와 연관 배열 역할을 모두 하는, PHP의 유일한 배열 타입" },
        { "term": "gettype()", "definition": "변수의 타입을 문자열로 반환하는 함수" },
        { "term": "\"a\" => 1", "definition": "연관 배열에서 키와 값을 연결하는 문법" }
      ],
      "explanation_en": "PHP's single unified array type (combining what Python separates into list and dict) is one of its most distinctive design choices, simplifying the mental model at the cost of some type precision.",
      "explanation_ko": "PHP의 통합된 단일 배열 타입(Python이 list와 dict로 나눈 것을 합침)은 가장 독특한 설계 선택 중 하나로, 타입 정밀도를 다소 희생하는 대신 사고 모델을 단순화합니다.",
      "concept_tags": ["dollar_sigil", "array"],
      "difficulty": "practice"
    }
  ]
}
