{
  "language": "c",
  "category": "system_low_level",
  "level": 4,
  "unit": 1,
  "unit_title": "연결 리스트 기초",
  "questions": [
    {
      "id": "c_l4_u01_q001",
      "type": "fill_blank",
      "code": "struct Node {\n    int data;\n    struct ____ *next;\n};",
      "prompt_en": "Fill in the blank to complete a self-referencing linked list node.",
      "prompt_ko": "자기 자신을 참조하는 연결 리스트 노드가 되도록 빈칸을 채우세요.",
      "options": ["Node", "int", "data", "next"],
      "answer": 0,
      "explanation_en": "A linked list node points to another node of the same type, so the pointer field's type must be struct Node.",
      "explanation_ko": "연결 리스트의 노드는 같은 타입의 다음 노드를 가리켜야 하므로, 포인터 필드의 자료형은 struct Node여야 합니다.",
      "concept_tags": ["linked_list", "struct"],
      "difficulty": "intro"
    },
    {
      "id": "c_l4_u01_q002",
      "type": "predict_output",
      "code": "struct Node {\n    int data;\n    struct Node *next;\n};\n\nstruct Node n3 = {3, NULL};\nstruct Node n2 = {2, &n3};\nstruct Node n1 = {1, &n2};\nstruct Node *head = &n1;\n\nstruct Node *cur = head;\nwhile (cur != NULL) {\n    printf(\"%d\", cur->data);\n    cur = cur->next;\n}",
      "prompt_en": "What is printed?",
      "prompt_ko": "출력 결과는?",
      "options": ["123", "321", "1", "무한 반복"],
      "answer": 0,
      "explanation_en": "Starting from head (n1), the loop follows each next pointer, printing 1, then 2, then 3, and stops when cur becomes NULL after n3.",
      "explanation_ko": "head(n1)부터 시작해 next 포인터를 따라가며 1, 2, 3을 차례로 출력하고, n3 다음이 NULL이 되는 순간 반복이 멈춥니다.",
      "concept_tags": ["linked_list", "traversal"],
      "difficulty": "practice"
    },
    {
      "id": "c_l4_u01_q003",
      "type": "concept_matching",
      "code": null,
      "prompt_en": "Match each term to its description.",
      "prompt_ko": "용어와 설명을 올바르게 연결하세요.",
      "pairs": [
        { "term": "노드 (Node)", "definition": "데이터와 다음 노드를 가리키는 포인터를 함께 담는 구조체" },
        { "term": "head", "definition": "연결 리스트의 첫 번째 노드를 가리키는 포인터" },
        { "term": "next", "definition": "현재 노드에서 다음 노드로 이어지는 연결" },
        { "term": "NULL", "definition": "더 이상 다음 노드가 없음을 나타내는 값, 리스트의 끝" }
      ],
      "explanation_en": "Unlike arrays, linked lists don't need contiguous memory — nodes can be scattered anywhere, connected only by their next pointers.",
      "explanation_ko": "배열과 달리 연결 리스트는 메모리가 연속적일 필요가 없습니다. 노드들은 어디에나 흩어져 있을 수 있고, next 포인터만으로 서로 연결됩니다.",
      "concept_tags": ["linked_list", "node"],
      "difficulty": "practice"
    },
    {
      "id": "c_l4_u01_q004",
      "type": "predict_output",
      "code": "struct Node {\n    int data;\n    struct Node *next;\n};\n\nstruct Node n3 = {3, NULL};\nstruct Node n2 = {2, &n3};\nstruct Node n1 = {1, &n2};\nstruct Node *head = &n1;\n\nint sum = 0;\nstruct Node *cur = head;\nwhile (cur != NULL) {\n    sum += cur->data;\n    cur = cur->next;\n}\nprintf(\"%d\", sum);",
      "prompt_en": "What is printed?",
      "prompt_ko": "출력 결과는?",
      "options": ["3", "6", "123", "오류"],
      "answer": 1,
      "explanation_en": "Traversing the list and accumulating each node's data (1+2+3) gives a total of 6 — the same traversal pattern used for arrays, applied to linked lists.",
      "explanation_ko": "리스트를 순회하며 각 노드의 data(1+2+3)를 누적하면 총 6이 됩니다. 배열을 순회하던 것과 동일한 패턴이 연결 리스트에도 그대로 적용됩니다.",
      "concept_tags": ["linked_list", "traversal"],
      "difficulty": "practice"
    },
    {
      "id": "c_l4_u01_q005",
      "type": "error_finding",
      "code": "struct Node {\n    int data;\n    struct Node *next;\n};\n\nstruct Node *cur = head;\nwhile (cur) {\n    printf(\"%d\", cur->data);\n}",
      "prompt_en": "What problem does this code have?",
      "prompt_ko": "이 코드는 어떤 문제가 있을까요?",
      "options": [
        "while(cur) 조건식 문법 오류",
        "cur = cur->next로 다음 노드로 이동하는 코드가 없어, cur가 계속 같은 노드를 가리켜 무한 루프가 발생함",
        "printf 형식 지정자 오류",
        "문제 없음, 정상 동작함"
      ],
      "answer": 1,
      "explanation_en": "Without advancing cur to cur->next inside the loop, cur never changes, so the loop keeps printing the same node's data forever.",
      "explanation_ko": "반복문 안에서 cur를 cur->next로 이동시키는 코드가 없기 때문에, cur는 절대 바뀌지 않고 같은 노드의 data를 영원히 출력하는 무한 루프가 됩니다.",
      "concept_tags": ["linked_list", "traversal", "infinite_loop"],
      "difficulty": "challenge"
    },
    {
      "id": "c_l4_u01_q006",
      "type": "fill_blank",
      "code": "struct Node {\n    int data;\n    struct Node *next;\n};\n\nstruct Node *cur = head;\nwhile (cur != NULL) {\n    printf(\"%d\", cur->data);\n    cur = cur____next;\n}",
      "prompt_en": "Fill in the blank with the operator used to access next through the pointer cur.",
      "prompt_ko": "포인터 cur를 통해 next에 접근할 때 쓰는 연산자를 빈칸에 채우세요.",
      "options": ["->", ".", "*", "&"],
      "answer": 0,
      "explanation_en": "Since cur is a pointer to a struct, the arrow operator is required to access its members, just as with any other struct pointer.",
      "explanation_ko": "cur는 구조체를 가리키는 포인터이므로, 다른 구조체 포인터와 마찬가지로 멤버에 접근할 때 화살표 연산자가 필요합니다.",
      "concept_tags": ["linked_list", "pointer", "arrow_operator"],
      "difficulty": "intro"
    }
  ]
}
