{
  "language": "pascal",
  "category": "legacy_historical",
  "level": 2,
  "unit": 4,
  "unit_title": "record",
  "questions": [
    {
      "id": "pascal_l2_u04_q001",
      "type": "predict_output",
      "code": "type\n  TPerson = record\n    name: string;\n    age: Integer;\n  end;\nvar\n  p: TPerson;\nbegin\n  p.name := 'Kim';\n  p.age := 25;\n  writeln(p.name, ' ', p.age);\nend.",
      "prompt_en": "What is printed?",
      "prompt_ko": "출력 결과는?",
      "options": ["Kim 25", "TPerson", "오류", "name age"],
      "answer": 0,
      "explanation_en": "record groups related fields together, similar to C's struct; dot notation accesses each field, printing Kim 25.",
      "explanation_ko": "record는 관련된 필드를 하나로 묶습니다. C의 struct와 비슷합니다. 점 표기법으로 각 필드에 접근해서 Kim 25를 출력합니다.",
      "concept_tags": ["record"],
      "difficulty": "intro"
    },
    {
      "id": "pascal_l2_u04_q002",
      "type": "fill_blank",
      "code": "type\n  TPoint = ____\n    x, y: Integer;\n  end;",
      "prompt_en": "Fill in the blank with the keyword that begins a field-grouping type definition.",
      "prompt_ko": "필드 묶음 타입 정의를 시작하는 키워드를 빈칸에 채우세요.",
      "options": ["record", "struct", "type", "class"],
      "answer": 0,
      "explanation_en": "record defines a value type that groups fields together, closed with a matching end.",
      "explanation_ko": "record는 필드를 묶는 값 타입을 정의하며, 짝이 되는 end로 닫습니다.",
      "concept_tags": ["record"],
      "difficulty": "intro"
    },
    {
      "id": "pascal_l2_u04_q003",
      "type": "predict_output",
      "code": "type\n  TPoint = record\n    x, y: Integer;\n  end;\nvar\n  p1, p2: TPoint;\nbegin\n  p1.x := 3;\n  p2 := p1;\n  p2.x := 100;\n  writeln(p1.x);\n  writeln(p2.x);\nend.",
      "prompt_en": "What is printed? (record is a value type — does copying preserve independence?)",
      "prompt_ko": "출력 결과는? (record는 값 타입입니다 — 복사가 독립성을 유지할까요?)",
      "options": ["3 100", "100 100", "3 3", "오류"],
      "answer": 0,
      "explanation_en": "record is a value type; p2 := p1 copies all fields, making p2 independent of p1, so changing p2.x doesn't affect p1.x.",
      "explanation_ko": "record는 값 타입입니다. p2 := p1은 모든 필드를 복사해서 p2를 p1과 독립적으로 만듭니다. 따라서 p2.x를 바꿔도 p1.x에는 영향이 없습니다.",
      "concept_tags": ["record", "value_type"],
      "difficulty": "challenge"
    },
    {
      "id": "pascal_l2_u04_q004",
      "type": "predict_output",
      "code": "type\n  TRectangle = record\n    width, height: Integer;\n  end;\n\nfunction Area(r: TRectangle): Integer;\nbegin\n  Area := r.width * r.height;\nend;\n\nvar\n  rect: TRectangle;\nbegin\n  rect.width := 4;\n  rect.height := 5;\n  writeln(Area(rect));\nend.",
      "prompt_en": "What is printed? (A record passed to a function.)",
      "prompt_ko": "출력 결과는? (함수에 record를 전달합니다.)",
      "options": ["9", "20", "45", "오류"],
      "answer": 1,
      "explanation_en": "Area receives a copy of rect (value parameter, as covered in the previous unit) and computes width * height = 4 * 5 = 20.",
      "explanation_ko": "Area는 rect의 복사본을 받습니다(이전 유닛에서 다룬 값 매개변수). width * height = 4 * 5 = 20을 계산합니다.",
      "concept_tags": ["record", "pass_by_value"],
      "difficulty": "practice"
    },
    {
      "id": "pascal_l2_u04_q005",
      "type": "predict_output",
      "code": "type\n  TPoint = record\n    x, y: Integer;\n  end;\nvar\n  points: array[1..2] of TPoint;\nbegin\n  points[1].x := 10;\n  points[2].x := 20;\n  writeln(points[1].x);\n  writeln(points[2].x);\nend.",
      "prompt_en": "What is printed? (An array of records.)",
      "prompt_ko": "출력 결과는? (record의 배열입니다.)",
      "options": ["10 20", "20 10", "오류", "0 0"],
      "answer": 0,
      "explanation_en": "Arrays and records combine naturally; each points[i] is an independent TPoint, so points[1].x and points[2].x hold their own values, 10 and 20.",
      "explanation_ko": "배열과 record는 자연스럽게 결합됩니다. 각 points[i]는 독립적인 TPoint이므로, points[1].x와 points[2].x는 각자의 값인 10과 20을 가집니다.",
      "concept_tags": ["record", "array_declaration"],
      "difficulty": "practice"
    },
    {
      "id": "pascal_l2_u04_q006",
      "type": "concept_matching",
      "code": null,
      "prompt_en": "Match each term to its description.",
      "prompt_ko": "용어와 설명을 올바르게 연결하세요.",
      "pairs": [
        { "term": "record", "definition": "관련된 필드를 하나로 묶는 값 타입" },
        { "term": "값 타입", "definition": "대입 시 전체가 복사되어, 원본과 사본이 서로 독립적인 성질" },
        { "term": "점 표기법", "definition": "record의 필드에 접근하는 문법 — p.x처럼" },
        { "term": "record의 배열", "definition": "여러 record를 담는 배열 — 표 형태 데이터를 표현하는 흔한 패턴" }
      ],
      "explanation_en": "Pascal's record is the direct conceptual ancestor of C's struct, VB's Structure, and C#'s struct — all sharing the same value-type copy semantics covered across this curriculum.",
      "explanation_ko": "Pascal의 record는 C의 struct, VB의 Structure, C#의 struct의 직접적인 개념적 조상입니다 — 모두 이 커리큘럼 전체에서 다룬 것과 같은 값 타입 복사 의미론을 공유합니다.",
      "concept_tags": ["record", "value_type"],
      "difficulty": "practice"
    }
  ]
}
