{
  "language": "cobol",
  "category": "legacy_historical",
  "level": 1,
  "unit": 1,
  "unit_title": "변수와 PIC절",
  "questions": [
    {
      "id": "cobol_l1_u01_q001",
      "type": "predict_output",
      "code": "01 X PIC 9(4).\n...\nMOVE 7 TO X.\nDISPLAY X.",
      "prompt_en": "What is printed? (This reveals how PIC fields are always fixed-width.)",
      "prompt_ko": "출력 결과는? (PIC 필드가 항상 고정폭이라는 것을 드러냅니다.)",
      "options": ["7", "0007", "X", "오류"],
      "answer": 1,
      "explanation_en": "PIC 9(4) declares a numeric field with exactly 4 digit positions; storing 7 fills the remaining digits with leading zeros, displaying as 0007.",
      "explanation_ko": "PIC 9(4)는 정확히 4자리 숫자 자리를 가진 필드를 선언합니다. 7을 저장하면 남은 자릿수가 앞의 0으로 채워져 0007로 출력됩니다.",
      "concept_tags": ["pic_clause", "numeric_field"],
      "difficulty": "challenge"
    },
    {
      "id": "cobol_l1_u01_q002",
      "type": "predict_output",
      "code": "01 NAME PIC X(10).\n...\nMOVE \"KIM\" TO NAME.\nDISPLAY NAME.",
      "prompt_en": "What is printed? (Note: PIC X(10) is exactly 10 characters wide.)",
      "prompt_ko": "출력 결과는? (PIC X(10)이 정확히 10글자 너비인 점에 주의하세요.)",
      "options": ["KIM", "\"KIM       \" (KIM 뒤에 공백 7개, 총 10글자)", "오류", "NAME"],
      "answer": 1,
      "explanation_en": "PIC X(10) declares a fixed-width alphanumeric field of exactly 10 characters; storing the 3-character \"KIM\" pads the rest with trailing spaces to fill all 10 positions.",
      "explanation_ko": "PIC X(10)은 정확히 10글자인 고정폭 영숫자 필드를 선언합니다. 3글자인 \"KIM\"을 저장하면 나머지가 후행 공백으로 채워져 10자리를 모두 채웁니다.",
      "concept_tags": ["pic_clause", "alphanumeric_field"],
      "difficulty": "challenge"
    },
    {
      "id": "cobol_l1_u01_q003",
      "type": "fill_blank",
      "code": "01 AGE PIC ____.\nMOVE 25 TO AGE.\n// 최대 두 자리 숫자를 저장해야 함",
      "prompt_en": "Fill in the blank with the PIC clause for a 2-digit numeric field.",
      "prompt_ko": "두 자리 숫자 필드를 위한 PIC절을 빈칸에 채우세요.",
      "options": ["9(2)", "99", "N(2)", "X(2)"],
      "answer": 0,
      "explanation_en": "9(2) specifies two numeric digit positions; 99 (repeating the 9 twice) would also work, but 9(2) is the standard repetition syntax.",
      "explanation_ko": "9(2)는 숫자 자릿수 두 개를 지정합니다. 99(9를 두 번 반복)도 동작하지만, 9(2)가 표준적인 반복 표기법입니다.",
      "concept_tags": ["pic_clause"],
      "difficulty": "intro"
    },
    {
      "id": "cobol_l1_u01_q004",
      "type": "fill_blank",
      "code": "01 X PIC 9(4).\n____ 7 TO X.\nDISPLAY X.",
      "prompt_en": "Fill in the blank with the keyword that assigns a value in COBOL.",
      "prompt_ko": "COBOL에서 값을 대입하는 키워드를 빈칸에 채우세요.",
      "options": ["MOVE", "SET", "LET", "ASSIGN"],
      "answer": 0,
      "explanation_en": "MOVE ... TO ... is COBOL's assignment statement, reading almost like an English sentence.",
      "explanation_ko": "MOVE ... TO ...는 COBOL의 대입문으로, 거의 영어 문장처럼 읽힙니다.",
      "concept_tags": ["move_statement"],
      "difficulty": "intro"
    },
    {
      "id": "cobol_l1_u01_q005",
      "type": "error_finding",
      "code": "01 NAME PIC X(3).\n...\nMOVE \"KIMBERLY\" TO NAME.\nDISPLAY NAME.",
      "prompt_en": "What problem does this code have? (The value is longer than the field.)",
      "prompt_ko": "이 코드는 어떤 문제가 있을까요? (값이 필드보다 긴 경우입니다.)",
      "options": [
        "NAME 선언 문법 오류",
        "\"KIMBERLY\"가 PIC X(3)의 3글자보다 길어서, 조용히 잘려 앞의 3글자인 \"KIM\"만 저장됨",
        "MOVE 문법 오류",
        "문제 없음, \"KIMBERLY\" 전체가 저장됨"
      ],
      "answer": 1,
      "explanation_en": "Since PIC fields have a fixed, unchangeable size, moving a longer value silently truncates it to fit — only the first 3 characters, KIM, are kept, the same kind of truncation seen in Fortran's fixed-length strings.",
      "explanation_ko": "PIC 필드는 고정된, 바꿀 수 없는 크기를 가지므로, 더 긴 값을 옮기면 조용히 잘려서 맞춰집니다. 처음 3글자인 KIM만 남습니다. Fortran의 고정 길이 문자열에서 봤던 것과 같은 종류의 자름입니다.",
      "concept_tags": ["pic_clause", "truncation"],
      "difficulty": "challenge"
    },
    {
      "id": "cobol_l1_u01_q006",
      "type": "concept_matching",
      "code": null,
      "prompt_en": "Match each term to its description.",
      "prompt_ko": "용어와 설명을 올바르게 연결하세요.",
      "pairs": [
        { "term": "PIC 9(n)", "definition": "정확히 n자리인 고정폭 숫자 필드 — 빈자리는 0으로 채움" },
        { "term": "PIC X(n)", "definition": "정확히 n글자인 고정폭 영숫자 필드 — 빈자리는 공백으로 채움" },
        { "term": "MOVE ... TO ...", "definition": "값을 변수에 대입하는 문장" },
        { "term": "고정폭의 결과", "definition": "값이 너무 짧으면 채워지고, 너무 길면 조용히 잘림" }
      ],
      "explanation_en": "COBOL's PIC clauses reflect its origins in an era of fixed-format punch cards and mainframe record layouts, where every field's exact width had to be known in advance — a design philosophy shared with Fortran's fixed-length strings.",
      "explanation_ko": "COBOL의 PIC절은 모든 필드의 정확한 너비를 미리 알아야 했던 고정 형식 펀치 카드와 메인프레임 레코드 레이아웃 시대의 기원을 반영합니다 — Fortran의 고정 길이 문자열과 공유하는 설계 철학입니다.",
      "concept_tags": ["pic_clause", "numeric_field", "alphanumeric_field"],
      "difficulty": "practice"
    }
  ]
}
