{
  "language": "python",
  "category": "scripting",
  "level": 4,
  "unit": 1,
  "unit_title": "리스트 심화",
  "questions": [
    {
      "id": "python_l4_u01_q001",
      "type": "predict_output",
      "code": "nums = [1, 2, 3, 4, 5]\nprint(nums[-1])",
      "prompt_en": "What is printed?",
      "prompt_ko": "출력 결과는?",
      "options": ["1", "5", "오류", "-1"],
      "answer": 1,
      "explanation_en": "Negative indices count from the end; nums[-1] refers to the last element, 5 — no equivalent shortcut exists in C/Java/C#.",
      "explanation_ko": "음수 인덱스는 끝에서부터 셉니다. nums[-1]은 마지막 요소인 5를 가리킵니다 — C/Java/C#에는 이런 단축 표현이 없습니다.",
      "concept_tags": ["negative_index"],
      "difficulty": "intro"
    },
    {
      "id": "python_l4_u01_q002",
      "type": "predict_output",
      "code": "nums = [1, 2, 3, 4, 5]\nprint(nums[1:3])",
      "prompt_en": "What is printed?",
      "prompt_ko": "출력 결과는?",
      "options": ["[1, 2, 3]", "[2, 3]", "[2, 3, 4]", "오류"],
      "answer": 1,
      "explanation_en": "Slicing [1:3] takes elements from index 1 up to (not including) index 3: [2, 3].",
      "explanation_ko": "슬라이싱 [1:3]은 인덱스 1부터 3 바로 전까지(3은 미포함)의 요소를 가져옵니다: [2, 3].",
      "concept_tags": ["slicing"],
      "difficulty": "practice"
    },
    {
      "id": "python_l4_u01_q003",
      "type": "predict_output",
      "code": "nums = [1, 2, 3, 4, 5]\nprint(nums[::-1])",
      "prompt_en": "What is printed? (Note: no start or stop, only a step of -1.)",
      "prompt_ko": "출력 결과는? (시작·끝 없이 증감만 -1인 점에 주의하세요.)",
      "options": ["[1, 2, 3, 4, 5]", "[5, 4, 3, 2, 1]", "오류", "[]"],
      "answer": 1,
      "explanation_en": "A step of -1 with no start/stop walks the entire list backward, producing a reversed copy without needing a separate reverse() call.",
      "explanation_ko": "시작·끝 없이 증감이 -1이면 리스트 전체를 거꾸로 훑어서, 별도의 reverse() 호출 없이도 뒤집힌 사본을 만듭니다.",
      "concept_tags": ["slicing"],
      "difficulty": "challenge"
    },
    {
      "id": "python_l4_u01_q004",
      "type": "predict_output",
      "code": "nums = [5, 2, 8, 1]\nnums.sort()\nprint(nums)",
      "prompt_en": "What is printed?",
      "prompt_ko": "출력 결과는?",
      "options": ["[5, 2, 8, 1]", "[1, 2, 5, 8]", "[8, 5, 2, 1]", "오류"],
      "answer": 1,
      "explanation_en": "sort() rearranges the list in place in ascending order: [1, 2, 5, 8].",
      "explanation_ko": "sort()는 리스트를 오름차순으로 제자리에서 정렬합니다: [1, 2, 5, 8].",
      "concept_tags": ["list_methods"],
      "difficulty": "intro"
    },
    {
      "id": "python_l4_u01_q005",
      "type": "error_finding",
      "code": "nums = [1, 2, 3]\nresult = nums.append(4)\nprint(result)",
      "prompt_en": "What is printed, given that this might not be what the programmer expected?",
      "prompt_ko": "프로그래머가 기대한 결과가 아닐 수도 있는데, 실제 출력은 무엇일까요?",
      "options": ["[1, 2, 3, 4]", "None", "4", "오류"],
      "answer": 1,
      "explanation_en": "append() modifies the list in place and returns None; assigning its result to result captures None, not the updated list — a common beginner mistake.",
      "explanation_ko": "append()는 리스트를 제자리에서 수정하고 None을 반환합니다. 그 결과를 result에 대입하면 갱신된 리스트가 아니라 None이 저장됩니다 — 흔한 초보자 실수입니다.",
      "concept_tags": ["list_methods", "none_return"],
      "difficulty": "challenge"
    },
    {
      "id": "python_l4_u01_q006",
      "type": "concept_matching",
      "code": null,
      "prompt_en": "Match each term to its description.",
      "prompt_ko": "용어와 설명을 올바르게 연결하세요.",
      "pairs": [
        { "term": "음수 인덱스", "definition": "끝에서부터 세는 인덱스 — nums[-1]은 마지막 요소" },
        { "term": "슬라이싱 [시작:끝:증감]", "definition": "리스트의 부분 구간을 새 리스트로 잘라내는 문법" },
        { "term": "sort() / append()", "definition": "리스트를 제자리에서 수정하고 None을 반환하는 메서드들" },
        { "term": "list.sorted() vs sorted(list)", "definition": "sort()는 원본을 바꾸지만, sorted()는 정렬된 새 리스트를 반환하고 원본은 그대로 둠" }
      ],
      "explanation_en": "Python's slicing syntax is one of its most powerful list features, letting complex extraction and reversal operations be expressed in a single concise expression.",
      "explanation_ko": "Python의 슬라이싱 문법은 가장 강력한 리스트 기능 중 하나로, 복잡한 추출과 반전 연산을 하나의 간결한 표현식으로 나타낼 수 있게 해줍니다.",
      "concept_tags": ["negative_index", "slicing", "list_methods"],
      "difficulty": "practice"
    }
  ]
}
